TABLE_NAME,COLUMN_NAME,IS_NULLABLE,DATA_TYPE,STANDARD_VOCABULARY,DESCRIPTION
procedure_cost,TOTAL_OUT_OF_POCKET,YES,"decimal(10,0)",   ," The total amount paid by the person as ashare of the expenses, excluding the copay.  "
procedure_cost,TOTAL_PAID,YES,"decimal(10,0)",   , The total amount paid for the expenses of the procedure.  
procedure_cost,DISEASE_CLASS_CONCEPT_ID,YES,int(11)," DRG, APC  "," A foreign key referring to a standard concept identifier in the vocabulary for disease classes, such as DRGs and APCs.  "
procedure_cost,REVENUE_CODE_CONCEPT_ID,YES,int(11), HCFA  , A foreign key referring to a standard concept identifier in the vocabulary for revenue codes.  
procedure_cost,PAYER_PLAN_PERIOD_ID,YES,bigint(20),   ," A foreign key to the payer_plan_period table, where the details of the payer, plan and family are stored.  "
procedure_cost,DISEASE_CLASS_SOURCE_VALUE,YES,varchar(50),   ," he source code for the disease class asit appears in the source data, stored here for reference.  "
procedure_cost,REVENUE_CODE_SOURCE_VALUE,YES,varchar(50),   ," The source code for the revenue code as it appears in the source data, stored here for reference.  "
cohort,COHORT_ID,NO,int(11),   , A system-generated unique identifier for each cohort record.   
cohort,COHORT_CONCEPT_ID,NO,int(11),   ," A foreign key to a standard cohort concept identifier in the vocabulary. Cohort concepts identify the cohorts: whether they are defined through persons, providers orvisits, or any combination thereof.  "
cohort,COHORT_START_DATE,NO,date,   ," The date when the cohort definition criteria for the person, provider or visit first match.  "
cohort,COHORT_END_DATE,YES,date,   ," The date when the cohort definition criteria for the person, provider or visit no longer match or the cohort membership was terminated.  "
cohort,SUBJECT_ID,NO,bigint(20),   ," A foreign key to the subject in the cohort. These could be referring to records in the Person, Provider, Visit Occurrence table.  "
cohort,STOP_REASON,YES,varchar(20),   , The reason for the end of a cohort membership other than defined by the cohort definition criteria as it appears in the source data.  
